4601,Oregon,    Local government ,215369.0,204094.0,205482.0
4602,Pennsylvania,Total employment (number of jobs) ,7773246.0,7413333.0,7618631.0
4603,Pennsylvania, Wage and salary employment ,6279475.0,5832095.0,5995350.0
4604,Pennsylvania, Proprietors employment ,1493771.0,1581238.0,1623281.0
4605,Pennsylvania,  Farm proprietors employment ,48567.0,48532.0,48565.0
4606,Pennsylvania,  Nonfarm proprietors employment 2/,1445204.0,1532706.0,1574716.0
4607,Pennsylvania, Farm employment ,68971.0,65730.0,69850.0
4608,Pennsylvania, Nonfarm employment ,7704275.0,7347603.0,7548781.0
4609,Pennsylvania,  Private nonfarm employment ,6932415.0,6591249.0,6800694.0
4610,Pennsylvania,"   Forestry, fishing, and related activities ",18066.0,18035.0,17751.0
4611,Pennsylvania,    Forestry and logging ,4228.0,3987.0,4067.0
4612,Pennsylvania,"    Fishing, hunting and trapping ",925.0,872.0,892.0
4613,Pennsylvania,    Support activities for agriculture and forestry ,12913.0,13176.0,12792.0
4614,Pennsylvania,"   Mining, quarrying, and oil and gas extraction ",40018.0,35484.0,33349.0
4615,Pennsylvania,    Oil and gas extraction ,12922.0,12501.0,11522.0
4616,Pennsylvania,    Mining (except oil and gas) ,12903.0,12782.0,12479.0
4617,Pennsylvania,    Support activities for mining ,14193.0,10201.0,9348.0
4618,Pennsylvania,   Utilities ,24851.0,24712.0,24699.0
4619,Pennsylvania,   Construction ,395025.0,383989.0,403327.0
4620,Pennsylvania,    Construction of buildings ,89285.0,87649.0,92485.0
4621,Pennsylvania,    Heavy and civil engineering construction ,46218.0,41616.0,42208.0
4622,Pennsylvania,    Specialty trade contractors ,259522.0,254724.0,268634.0
4623,Pennsylvania,   Manufacturing ,603478.0,566615.0,572656.0
4624,Pennsylvania,    Durable goods manufacturing ,363547.0,336624.0,338486.0
4625,Pennsylvania,     Wood product manufacturing ,25600.0,24732.0,25463.0
4626,Pennsylvania,     Nonmetallic mineral product manufacturing ,22074.0,20154.0,20166.0
4627,Pennsylvania,     Primary metal manufacturing ,36497.0,32640.0,31546.0
4628,Pennsylvania,     Fabricated metal product manufacturing ,85786.0,79465.0,79989.0
4629,Pennsylvania,     Machinery manufacturing ,47736.0,44365.0,44079.0
4630,Pennsylvania,     Computer and electronic product manufacturing ,30586.0,29176.0,28826.0
4631,Pennsylvania,"     Electrical equipment, appliance, and component manufacturing ",27805.0,26202.0,25903.0
4632,Pennsylvania,"     Motor vehicles, bodies and trailers, and parts manufacturing ",18021.0,14747.0,15856.0
4633,Pennsylvania,     Other transportation equipment manufacturing ,21452.0,20353.0,20406.0
4634,Pennsylvania,     Furniture and related product manufacturing ,17737.0,15845.0,16749.0
4635,Pennsylvania,     Miscellaneous manufacturing ,30253.0,28945.0,29503.0
4636,Pennsylvania,    Nondurable goods manufacturing ,239931.0,229991.0,234170.0
4637,Pennsylvania,     Food manufacturing ,77001.0,74966.0,76433.0
4638,Pennsylvania,     Beverage and tobacco product manufacturing ,11895.0,11414.0,12635.0
4639,Pennsylvania,     Textile mills ,3574.0,3257.0,3199.0
4640,Pennsylvania,     Textile product mills ,3528.0,3138.0,3325.0
4641,Pennsylvania,     Apparel manufacturing ,5530.0,4958.0,5385.0
4642,Pennsylvania,     Leather and allied product manufacturing ,1149.0,1006.0,1068.0
4643,Pennsylvania,     Paper manufacturing ,22299.0,21216.0,21045.0
4644,Pennsylvania,     Printing and related support activities ,24321.0,21762.0,20773.0
4645,Pennsylvania,     Petroleum and coal products manufacturing ,6015.0,4949.0,4890.0
4646,Pennsylvania,     Chemical manufacturing ,43766.0,43912.0,45133.0
4647,Pennsylvania,     Plastics and rubber products manufacturing ,40853.0,39413.0,40284.0
4648,Pennsylvania,   Wholesale trade ,236779.0,224533.0,224845.0
4649,Pennsylvania,   Retail trade ,738456.0,703611.0,735094.0
4650,Pennsylvania,    Motor vehicle and parts dealers ,88464.0,81434.0,83626.0
4651,Pennsylvania,    Furniture and home furnishings stores ,17992.0,15647.0,17106.0
4652,Pennsylvania,    Electronics and appliance stores ,17267.0,15030.0,14700.0
4653,Pennsylvania,    Building material and garden equipment and supplies dealers ,47933.0,49504.0,50792.0
4654,Pennsylvania,    Food and beverage stores ,145409.0,144809.0,147079.0
4655,Pennsylvania,    Health and personal care stores ,49514.0,45837.0,47884.0
4656,Pennsylvania,    Gasoline stations ,42508.0,41171.0,42271.0
4657,Pennsylvania,    Clothing and clothing accessories stores ,49402.0,37713.0,39090.0
4658,Pennsylvania,"    Sporting goods, hobby, musical instrument, and book stores ",26693.0,23225.0,25383.0
4659,Pennsylvania,    General merchandise stores ,107973.0,101479.0,110249.0
4660,Pennsylvania,    Miscellaneous store retailers ,65447.0,61408.0,66686.0
4661,Pennsylvania,    Nonstore retailers ,79854.0,86354.0,90228.0
4662,Pennsylvania,   Transportation and warehousing ,390785.0,403638.0,430225.0
4663,Pennsylvania,    Air transportation ,14164.0,12865.0,12964.0
4664,Pennsylvania,    Rail transportation ,8323.0,7343.0,7013.0
4665,Pennsylvania,    Water transportation ,833.0,808.0,798.0
4666,Pennsylvania,    Truck transportation ,90843.0,88969.0,90828.0
4667,Pennsylvania,    Transit and ground passenger transportation ,99861.0,81574.0,83032.0
4668,Pennsylvania,    Pipeline transportation ,2399.0,2330.0,2297.0
4669,Pennsylvania,    Scenic and sightseeing transportation ,1094.0,660.0,794.0
4670,Pennsylvania,    Support activities for transportation ,21041.0,18581.0,19141.0
4671,Pennsylvania,    Couriers and messengers ,57682.0,90273.0,102628.0
4672,Pennsylvania,    Warehousing and storage ,94545.0,100235.0,110730.0
4673,Pennsylvania,   Information ,103608.0,100757.0,103763.0
4674,Pennsylvania,    Publishing industries (except Internet) ,29881.0,30564.0,31123.0
4675,Pennsylvania,    Motion picture and sound recording industries ,10724.0,7270.0,8867.0
4676,Pennsylvania,    Broadcasting (except Internet) ,9294.0,8859.0,8633.0
4677,Pennsylvania,    Internet publishing and broadcasting 3/,,,
4678,Pennsylvania,    Telecommunications ,31392.0,31040.0,30427.0
4679,Pennsylvania,"    Data processing, hosting, and related services ",12579.0,13622.0,14840.0
4680,Pennsylvania,    Other information services 3/,9738.0,9402.0,9873.0
4681,Pennsylvania,   Finance and insurance ,411222.0,435445.0,443735.0
4682,Pennsylvania,    Monetary Authorities-central bank ,,,
4683,Pennsylvania,    Credit intermediation and related activities ,97034.0,99429.0,100361.0
4684,Pennsylvania,"    Securities, commodity contracts, and other financial investments and related activities ",135367.0,153810.0,163743.0
4685,Pennsylvania,    Insurance carriers and related activities ,164113.0,164674.0,160504.0
4686,Pennsylvania,"    Funds, trusts, and other financial vehicles ",,,
4687,Pennsylvania,   Real estate and rental and leasing ,303876.0,327320.0,336968.0
4688,Pennsylvania,    Real estate ,277329.0,302630.0,311972.0
4689,Pennsylvania,    Rental and leasing services ,25755.0,23888.0,24129.0
4690,Pennsylvania,    Lessors of nonfinancial intangible assets (except copyrighted works) ,792.0,802.0,867.0
4691,Pennsylvania,"   Professional, scientific, and technical services ",527816.0,521012.0,533629.0
4692,Pennsylvania,   Management of companies and enterprises ,146556.0,138340.0,149532.0
4693,Pennsylvania,   Administrative and support and waste management and remediation services ,404356.0,367011.0,380141.0
4694,Pennsylvania,    Administrative and support services ,383799.0,347156.0,359818.0
4695,Pennsylvania,    Waste management and remediation services ,20557.0,19855.0,20323.0
4696,Pennsylvania,   Educational services ,316144.0,299792.0,306274.0
4697,Pennsylvania,   Health care and social assistance ,1150428.0,1111585.0,1107312.0
4698,Pennsylvania,    Ambulatory health care services ,405880.0,390954.0,404280.0
4699,Pennsylvania,    Hospitals ,277607.0,276032.0,267234.0
4700,Pennsylvania,    Nursing and residential care facilities ,209186.0,196849.0,182512.0
4701,Pennsylvania,    Social assistance ,257755.0,247750.0,253286.0
4702,Pennsylvania,"   Arts, entertainment, and recreation ",175825.0,138999.0,153930.0
4703,Pennsylvania,"    Performing arts, spectator sports, and related industries ",81787.0,70718.0,74626.0
4704,Pennsylvania,"    Museums, historical sites, and similar institutions ",8546.0,6195.0,6772.0
4705,Pennsylvania,"    Amusement, gambling, and recreation industries ",85492.0,62086.0,72532.0
4706,Pennsylvania,   Accommodation and food services ,516056.0,398673.0,442397.0
4707,Pennsylvania,    Accommodation ,69427.0,47871.0,52556.0
4708,Pennsylvania,    Food services and drinking places ,446629.0,350802.0,389841.0
4709,Pennsylvania,   Other services (except government and government enterprises) ,429070.0,391698.0,401067.0
4710,Pennsylvania,    Repair and maintenance ,88577.0,86243.0,88254.0
4711,Pennsylvania,    Personal and laundry services ,155670.0,139463.0,148060.0
4712,Pennsylvania,"    Religious, grantmaking, civic, professional, and similar organizations ",153297.0,139457.0,138141.0
4713,Pennsylvania,    Private households ,31526.0,26535.0,26612.0
4714,Pennsylvania,  Government and government enterprises ,771860.0,756354.0,748087.0
4715,Pennsylvania,   Federal civilian ,98258.0,101442.0,99084.0
4716,Pennsylvania,   Military ,32724.0,31973.0,31478.0
4717,Pennsylvania,   State and local ,640878.0,622939.0,617525.0
4718,Pennsylvania,    State government ,188320.0,189056.0,186821.0
4719,Pennsylvania,    Local government ,452558.0,433883.0,430704.0
4720,Rhode Island,Total employment (number of jobs) ,651037.0,615726.0,639211.0
4721,Rhode Island, Wage and salary employment ,517368.0,475074.0,494738.0
4722,Rhode Island, Proprietors employment ,133669.0,140652.0,144473.0
4723,Rhode Island,  Farm proprietors employment ,933.0,933.0,933.0
4724,Rhode Island,  Nonfarm proprietors employment 2/,132736.0,139719.0,143540.0
4725,Rhode Island, Farm employment ,1418.0,1396.0,1407.0
4726,Rhode Island, Nonfarm employment ,649619.0,614330.0,637804.0
4727,Rhode Island,  Private nonfarm employment ,574189.0,541032.0,564308.0
4728,Rhode Island,"   Forestry, fishing, and related activities ",,,1853.0
4729,Rhode Island,    Forestry and logging ,,,
4730,Rhode Island,"    Fishing, hunting and trapping ",,,
4731,Rhode Island,    Support activities for agriculture and forestry ,,319.0,
4732,Rhode Island,"   Mining, quarrying, and oil and gas extraction ",,,516.0
4733,Rhode Island,    Oil and gas extraction ,121.0,159.0,148.0
4734,Rhode Island,    Mining (except oil and gas) ,,,361.0
4735,Rhode Island,    Support activities for mining ,16.0,7.0,7.0
4736,Rhode Island,   Utilities ,1690.0,1743.0,1840.0
4737,Rhode Island,   Construction ,32366.0,31879.0,33619.0
4738,Rhode Island,    Construction of buildings ,7368.0,7421.0,7778.0
4739,Rhode Island,    Heavy and civil engineering construction ,2489.0,2456.0,2521.0
4740,Rhode Island,    Specialty trade contractors ,22509.0,22002.0,23320.0
4741,Rhode Island,   Manufacturing ,41878.0,39630.0,41290.0
4742,Rhode Island,    Durable goods manufacturing ,26917.0,24786.0,25854.0
4743,Rhode Island,     Wood product manufacturing ,576.0,,476.0
4744,Rhode Island,     Nonmetallic mineral product manufacturing ,832.0,749.0,804.0
4745,Rhode Island,     Primary metal manufacturing ,1438.0,1302.0,1331.0
4746,Rhode Island,     Fabricated metal product manufacturing ,4809.0,4357.0,4324.0
4747,Rhode Island,     Machinery manufacturing ,1992.0,1819.0,
4748,Rhode Island,     Computer and electronic product manufacturing ,3895.0,3832.0,4003.0
4749,Rhode Island,"     Electrical equipment, appliance, and component manufacturing ",1201.0,,972.0
4750,Rhode Island,"     Motor vehicles, bodies and trailers, and parts manufacturing ",299.0,295.0,
4751,Rhode Island,     Other transportation equipment manufacturing ,5284.0,4898.0,
4752,Rhode Island,     Furniture and related product manufacturing ,1234.0,1146.0,1200.0
4753,Rhode Island,     Miscellaneous manufacturing ,5357.0,4767.0,5045.0
4754,Rhode Island,    Nondurable goods manufacturing ,14961.0,14844.0,15436.0
4755,Rhode Island,     Food manufacturing ,3357.0,3615.0,4023.0
4756,Rhode Island,     Beverage and tobacco product manufacturing ,650.0,587.0,689.0
4757,Rhode Island,     Textile mills ,1815.0,1716.0,1715.0
4758,Rhode Island,     Textile product mills ,516.0,479.0,481.0
4759,Rhode Island,     Apparel manufacturing ,246.0,,289.0
4760,Rhode Island,     Leather and allied product manufacturing ,,117.0,
4761,Rhode Island,     Paper manufacturing ,1320.0,1117.0,1092.0
4762,Rhode Island,     Printing and related support activities ,1792.0,1661.0,1756.0
4763,Rhode Island,     Petroleum and coal products manufacturing ,,,
4764,Rhode Island,     Chemical manufacturing ,2915.0,2955.0,2925.0
4765,Rhode Island,     Plastics and rubber products manufacturing ,2138.0,2235.0,2241.0
4766,Rhode Island,   Wholesale trade ,18337.0,16692.0,17264.0
4767,Rhode Island,   Retail trade ,56536.0,53423.0,56236.0
4768,Rhode Island,    Motor vehicle and parts dealers ,6587.0,5862.0,6028.0
4769,Rhode Island,    Furniture and home furnishings stores ,1502.0,1289.0,1301.0
4770,Rhode Island,    Electronics and appliance stores ,1232.0,1221.0,1258.0
4771,Rhode Island,    Building material and garden equipment and supplies dealers ,3942.0,4133.0,4302.0
4772,Rhode Island,    Food and beverage stores ,12117.0,11798.0,12410.0
4773,Rhode Island,    Health and personal care stores ,5273.0,4778.0,4885.0
4774,Rhode Island,    Gasoline stations ,2200.0,2092.0,2078.0
4775,Rhode Island,    Clothing and clothing accessories stores ,4533.0,3568.0,4125.0
4776,Rhode Island,"    Sporting goods, hobby, musical instrument, and book stores ",1733.0,1601.0,1769.0
4777,Rhode Island,    General merchandise stores ,7249.0,6981.0,7394.0
4778,Rhode Island,    Miscellaneous store retailers ,5116.0,4815.0,5235.0
4779,Rhode Island,    Nonstore retailers ,5052.0,5285.0,5451.0
4780,Rhode Island,   Transportation and warehousing ,21505.0,22280.0,23896.0
4781,Rhode Island,    Air transportation ,437.0,390.0,358.0
4782,Rhode Island,    Rail transportation ,,,
4783,Rhode Island,    Water transportation ,280.0,213.0,221.0
4784,Rhode Island,    Truck transportation ,3383.0,3254.0,3408.0
4785,Rhode Island,    Transit and ground passenger transportation ,9409.0,7063.0,7568.0
4786,Rhode Island,    Pipeline transportation ,,,
4787,Rhode Island,    Scenic and sightseeing transportation ,244.0,181.0,
4788,Rhode Island,    Support activities for transportation ,1576.0,1675.0,1618.0
4789,Rhode Island,    Couriers and messengers ,4453.0,7300.0,8361.0
4790,Rhode Island,    Warehousing and storage ,1429.0,1916.0,1872.0
4791,Rhode Island,   Information ,7412.0,6887.0,7064.0
4792,Rhode Island,    Publishing industries (except Internet) ,1923.0,1878.0,1887.0
4793,Rhode Island,    Motion picture and sound recording industries ,1035.0,676.0,821.0
4794,Rhode Island,    Broadcasting (except Internet) ,757.0,694.0,682.0
4795,Rhode Island,    Internet publishing and broadcasting 3/,,,
4796,Rhode Island,    Telecommunications ,2262.0,2255.0,2200.0
4797,Rhode Island,"    Data processing, hosting, and related services ",754.0,732.0,785.0
4798,Rhode Island,    Other information services 3/,681.0,652.0,689.0
4799,Rhode Island,   Finance and insurance ,37267.0,39373.0,39870.0
4800,Rhode Island,    Monetary Authorities-central bank ,0.0,0.0,0.0
4801,Rhode Island,    Credit intermediation and related activities ,12312.0,12356.0,12365.0
4802,Rhode Island,"    Securities, commodity contracts, and other financial investments and related activities ",11674.0,13520.0,
4803,Rhode Island,    Insurance carriers and related activities ,12258.0,12384.0,12215.0
4804,Rhode Island,"    Funds, trusts, and other financial vehicles ",1023.0,1113.0,
4805,Rhode Island,   Real estate and rental and leasing ,29350.0,31231.0,32180.0
4806,Rhode Island,    Real estate ,27209.0,29405.0,30355.0
4807,Rhode Island,    Rental and leasing services ,2072.0,1748.0,1738.0
4808,Rhode Island,    Lessors of nonfinancial intangible assets (except copyrighted works) ,69.0,78.0,87.0
4809,Rhode Island,"   Professional, scientific, and technical services ",42780.0,42683.0,44947.0
4810,Rhode Island,   Management of companies and enterprises ,14207.0,13769.0,13491.0
4811,Rhode Island,   Administrative and support and waste management and remediation services ,37386.0,34938.0,36288.0
4812,Rhode Island,    Administrative and support services ,35496.0,33209.0,34424.0
4813,Rhode Island,    Waste management and remediation services ,1890.0,1729.0,1864.0
4814,Rhode Island,   Educational services ,34251.0,32148.0,32382.0
4815,Rhode Island,   Health care and social assistance ,90421.0,84490.0,85920.0
4816,Rhode Island,    Ambulatory health care services ,32318.0,30823.0,32830.0
4817,Rhode Island,    Hospitals ,23995.0,23192.0,23354.0
4818,Rhode Island,    Nursing and residential care facilities ,18142.0,16337.0,15158.0
4819,Rhode Island,    Social assistance ,15966.0,14138.0,14578.0
4820,Rhode Island,"   Arts, entertainment, and recreation ",16328.0,13525.0,14689.0
4821,Rhode Island,"    Performing arts, spectator sports, and related industries ",8477.0,7409.0,7736.0
4822,Rhode Island,"    Museums, historical sites, and similar institutions ",1097.0,726.0,787.0
4823,Rhode Island,"    Amusement, gambling, and recreation industries ",6754.0,5390.0,6166.0
4824,Rhode Island,   Accommodation and food services ,55462.0,42551.0,48692.0
4825,Rhode Island,    Accommodation ,8048.0,5134.0,5946.0
4826,Rhode Island,    Food services and drinking places ,47414.0,37417.0,42746.0
4827,Rhode Island,   Other services (except government and government enterprises) ,34745.0,31398.0,32271.0
4828,Rhode Island,    Repair and maintenance ,6963.0,6596.0,6795.0
4829,Rhode Island,    Personal and laundry services ,15532.0,14255.0,14931.0
4830,Rhode Island,"    Religious, grantmaking, civic, professional, and similar organizations ",9797.0,8478.0,8467.0
4831,Rhode Island,    Private households ,2453.0,2069.0,2078.0
4832,Rhode Island,  Government and government enterprises ,75430.0,73298.0,73496.0
4833,Rhode Island,   Federal civilian ,11191.0,11534.0,11374.0
4834,Rhode Island,   Military ,7390.0,7287.0,7558.0
4835,Rhode Island,   State and local ,56849.0,54477.0,54564.0
4836,Rhode Island,    State government ,24023.0,23516.0,23085.0
4837,Rhode Island,    Local government ,32826.0,30961.0,31479.0
4838,South Carolina,Total employment (number of jobs) ,2882340.0,2825222.0,2904842.0
4839,South Carolina, Wage and salary employment ,2267406.0,2159636.0,2222660.0
4840,South Carolina, Proprietors employment ,614934.0,665586.0,682182.0
4841,South Carolina,  Farm proprietors employment ,21108.0,21096.0,21108.0
4842,South Carolina,  Nonfarm proprietors employment 2/,593826.0,644490.0,661074.0
4843,South Carolina, Farm employment ,26311.0,26763.0,26725.0
4844,South Carolina, Nonfarm employment ,2856029.0,2798459.0,2878117.0
4845,South Carolina,  Private nonfarm employment ,2441690.0,2391096.0,2475693.0
4846,South Carolina,"   Forestry, fishing, and related activities ",12247.0,12351.0,12074.0
4847,South Carolina,    Forestry and logging ,4889.0,4757.0,4740.0
4848,South Carolina,"    Fishing, hunting and trapping ",1234.0,1209.0,1225.0
4849,South Carolina,    Support activities for agriculture and forestry ,6124.0,6385.0,6109.0
4850,South Carolina,"   Mining, quarrying, and oil and gas extraction ",4091.0,4302.0,4185.0
4851,South Carolina,    Oil and gas extraction ,,1750.0,1626.0
4852,South Carolina,    Mining (except oil and gas) ,1993.0,2206.0,2294.0
4853,South Carolina,    Support activities for mining ,,346.0,265.0
4854,South Carolina,   Utilities ,12064.0,11944.0,11717.0
4855,South Carolina,   Construction ,166312.0,170283.0,174169.0
4856,South Carolina,    Construction of buildings ,36945.0,37597.0,38838.0
4857,South Carolina,    Heavy and civil engineering construction ,19658.0,19000.0,18610.0
4858,South Carolina,    Specialty trade contractors ,109709.0,113686.0,116721.0
4859,South Carolina,   Manufacturing ,267934.0,254654.0,259957.0
4860,South Carolina,    Durable goods manufacturing ,158149.0,150645.0,154251.0
4861,South Carolina,     Wood product manufacturing ,8935.0,8362.0,8544.0
4862,South Carolina,     Nonmetallic mineral product manufacturing ,7980.0,7501.0,7632.0
4863,South Carolina,     Primary metal manufacturing ,6423.0,6042.0,6020.0
4864,South Carolina,     Fabricated metal product manufacturing ,26368.0,24453.0,24299.0
4865,South Carolina,     Machinery manufacturing ,22358.0,21709.0,22992.0
4866,South Carolina,     Computer and electronic product manufacturing ,7165.0,7211.0,6877.0
4867,South Carolina,"     Electrical equipment, appliance, and component manufacturing ",13885.0,14098.0,15769.0
4868,South Carolina,"     Motor vehicles, bodies and trailers, and parts manufacturing ",38223.0,35615.0,36774.0
4869,South Carolina,     Other transportation equipment manufacturing ,13569.0,12726.0,12047.0
4870,South Carolina,     Furniture and related product manufacturing ,3511.0,3582.0,3940.0
4871,South Carolina,     Miscellaneous manufacturing ,9732.0,9346.0,9357.0
4872,South Carolina,    Nondurable goods manufacturing ,109785.0,104009.0,105706.0
4873,South Carolina,     Food manufacturing ,20314.0,19781.0,19782.0
4874,South Carolina,     Beverage and tobacco product manufacturing ,2188.0,2240.0,2572.0
4875,South Carolina,     Textile mills ,14809.0,13051.0,13004.0
4876,South Carolina,     Textile product mills ,3404.0,3145.0,3227.0
4877,South Carolina,     Apparel manufacturing ,1320.0,1300.0,1314.0
4878,South Carolina,     Leather and allied product manufacturing ,200.0,171.0,167.0
4879,South Carolina,     Paper manufacturing ,12476.0,11842.0,11561.0
4880,South Carolina,     Printing and related support activities ,5818.0,5719.0,5588.0
4881,South Carolina,     Petroleum and coal products manufacturing ,573.0,574.0,561.0
4882,South Carolina,     Chemical manufacturing ,24036.0,23017.0,23635.0
4883,South Carolina,     Plastics and rubber products manufacturing ,24647.0,23169.0,24295.0
4884,South Carolina,   Wholesale trade ,81073.0,81053.0,83065.0
4885,South Carolina,   Retail trade ,301988.0,301574.0,309576.0
4886,South Carolina,    Motor vehicle and parts dealers ,36578.0,36120.0,36755.0
4887,South Carolina,    Furniture and home furnishings stores ,8009.0,7512.0,8213.0
4888,South Carolina,    Electronics and appliance stores ,6860.0,6690.0,5292.0
4889,South Carolina,    Building material and garden equipment and supplies dealers ,24181.0,25862.0,26336.0
4890,South Carolina,    Food and beverage stores ,49676.0,52319.0,52672.0
4891,South Carolina,    Health and personal care stores ,18830.0,18061.0,18879.0
4892,South Carolina,    Gasoline stations ,19673.0,19778.0,20143.0
4893,South Carolina,    Clothing and clothing accessories stores ,24957.0,21006.0,20544.0
4894,South Carolina,"    Sporting goods, hobby, musical instrument, and book stores ",11324.0,10673.0,11617.0
4895,South Carolina,    General merchandise stores ,54995.0,54691.0,58087.0
4896,South Carolina,    Miscellaneous store retailers ,24001.0,23739.0,24994.0
4897,South Carolina,    Nonstore retailers ,22904.0,25123.0,26044.0
4898,South Carolina,   Transportation and warehousing ,107053.0,116061.0,125584.0
4899,South Carolina,    Air transportation ,1542.0,1450.0,1498.0
4900,South Carolina,    Rail transportation ,1346.0,,1173.0
4901,South Carolina,    Water transportation ,539.0,521.0,530.0
4902,South Carolina,    Truck transportation ,33902.0,34591.0,35942.0
4903,South Carolina,    Transit and ground passenger transportation ,16260.0,14466.0,14172.0
4904,South Carolina,    Pipeline transportation ,92.0,,111.0
4905,South Carolina,    Scenic and sightseeing transportation ,954.0,819.0,901.0
4906,South Carolina,    Support activities for transportation ,11358.0,10973.0,11662.0
4907,South Carolina,    Couriers and messengers ,16819.0,26316.0,30811.0
4908,South Carolina,    Warehousing and storage ,24241.0,25604.0,28784.0
4909,South Carolina,   Information ,33185.0,31920.0,34527.0
4910,South Carolina,    Publishing industries (except Internet) ,7211.0,6976.0,8620.0
4911,South Carolina,    Motion picture and sound recording industries ,3232.0,1948.0,2323.0
4912,South Carolina,    Broadcasting (except Internet) ,3144.0,3022.0,2879.0
4913,South Carolina,    Internet publishing and broadcasting 3/,,,
4914,South Carolina,    Telecommunications ,13421.0,13501.0,13764.0
4915,South Carolina,"    Data processing, hosting, and related services ",4575.0,4790.0,4885.0
4916,South Carolina,    Other information services 3/,1602.0,1683.0,2056.0
4917,South Carolina,   Finance and insurance ,116805.0,127570.0,132045.0
4918,South Carolina,    Monetary Authorities-central bank ,67.0,93.0,145.0
4919,South Carolina,    Credit intermediation and related activities ,37854.0,39401.0,40419.0
4920,South Carolina,"    Securities, commodity contracts, and other financial investments and related activities ",29294.0,35797.0,38694.0
4921,South Carolina,    Insurance carriers and related activities ,45238.0,46854.0,46809.0
4922,South Carolina,"    Funds, trusts, and other financial vehicles ",4352.0,5425.0,5978.0
4923,South Carolina,   Real estate and rental and leasing ,131233.0,142047.0,146442.0
4924,South Carolina,    Real estate ,120420.0,131843.0,135951.0
4925,South Carolina,    Rental and leasing services ,10513.0,9885.0,10148.0
4926,South Carolina,    Lessors of nonfinancial intangible assets (except copyrighted works) ,300.0,319.0,343.0
4927,South Carolina,"   Professional, scientific, and technical services ",161821.0,162488.0,166766.0
