1505,Hawaii,"   Professional, scientific, and technical services ",46488.0,45197.0,46404.0
1506,Hawaii,   Management of companies and enterprises ,9784.0,9058.0,9149.0
1507,Hawaii,   Administrative and support and waste management and remediation services ,55609.0,48431.0,49087.0
1508,Hawaii,    Administrative and support services ,53394.0,46221.0,46867.0
1509,Hawaii,    Waste management and remediation services ,2215.0,2210.0,2220.0
1510,Hawaii,   Educational services ,20801.0,18154.0,19031.0
1511,Hawaii,   Health care and social assistance ,85560.0,83233.0,84663.0
1512,Hawaii,    Ambulatory health care services ,38783.0,37959.0,39826.0
1513,Hawaii,    Hospitals ,16917.0,16725.0,16688.0
1514,Hawaii,    Nursing and residential care facilities ,9987.0,9959.0,9839.0
1515,Hawaii,    Social assistance ,19873.0,18590.0,18310.0
1516,Hawaii,"   Arts, entertainment, and recreation ",24622.0,18102.0,19667.0
1517,Hawaii,"    Performing arts, spectator sports, and related industries ",10700.0,9229.0,9748.0
1518,Hawaii,"    Museums, historical sites, and similar institutions ",3225.0,1853.0,1906.0
1519,Hawaii,"    Amusement, gambling, and recreation industries ",10697.0,7020.0,8013.0
1520,Hawaii,   Accommodation and food services ,119373.0,75795.0,91951.0
1521,Hawaii,    Accommodation ,44756.0,23624.0,30520.0
1522,Hawaii,    Food services and drinking places ,74617.0,52171.0,61431.0
1523,Hawaii,   Other services (except government and government enterprises) ,51408.0,45662.0,46107.0
1524,Hawaii,    Repair and maintenance ,9015.0,8411.0,8485.0
1525,Hawaii,    Personal and laundry services ,21884.0,18591.0,19254.0
1526,Hawaii,"    Religious, grantmaking, civic, professional, and similar organizations ",17140.0,15834.0,15549.0
1527,Hawaii,    Private households ,3369.0,2826.0,2819.0
1528,Hawaii,  Government and government enterprises ,176606.0,171578.0,172227.0
1529,Hawaii,   Federal civilian ,34299.0,35125.0,34755.0
1530,Hawaii,   Military ,50764.0,50798.0,51776.0
1531,Hawaii,   State and local ,91543.0,85655.0,85696.0
1532,Hawaii,    State government ,72124.0,66547.0,66759.0
1533,Hawaii,    Local government ,19419.0,19108.0,18937.0
1534,Idaho,Total employment (number of jobs) ,1064118.0,1078122.0,1125054.0
1535,Idaho, Wage and salary employment ,799581.0,791873.0,831903.0
1536,Idaho, Proprietors employment ,264537.0,286249.0,293151.0
1537,Idaho,  Farm proprietors employment ,22546.0,22530.0,22544.0
1538,Idaho,  Nonfarm proprietors employment 2/,241991.0,263719.0,270607.0
1539,Idaho, Farm employment ,42154.0,40813.0,38894.0
1540,Idaho, Nonfarm employment ,1021964.0,1037309.0,1086160.0
1541,Idaho,  Private nonfarm employment ,884770.0,903493.0,951287.0
1542,Idaho,"   Forestry, fishing, and related activities ",13160.0,13291.0,12981.0
1543,Idaho,    Forestry and logging ,2212.0,2129.0,2191.0
1544,Idaho,"    Fishing, hunting and trapping ",745.0,683.0,699.0
1545,Idaho,    Support activities for agriculture and forestry ,10203.0,10479.0,10091.0
1546,Idaho,"   Mining, quarrying, and oil and gas extraction ",3989.0,4380.0,4579.0
1547,Idaho,    Oil and gas extraction ,811.0,731.0,679.0
1548,Idaho,    Mining (except oil and gas) ,2744.0,3185.0,3410.0
1549,Idaho,    Support activities for mining ,434.0,464.0,490.0
1550,Idaho,   Utilities ,3226.0,3228.0,3347.0
1551,Idaho,   Construction ,77075.0,82330.0,88220.0
1552,Idaho,    Construction of buildings ,17991.0,19355.0,20722.0
1553,Idaho,    Heavy and civil engineering construction ,7394.0,7847.0,8201.0
1554,Idaho,    Specialty trade contractors ,51690.0,55128.0,59297.0
1555,Idaho,   Manufacturing ,74951.0,74577.0,77093.0
1556,Idaho,    Durable goods manufacturing ,43566.0,42988.0,44485.0
1557,Idaho,     Wood product manufacturing ,7491.0,7266.0,7477.0
1558,Idaho,     Nonmetallic mineral product manufacturing ,2064.0,1968.0,2174.0
1559,Idaho,     Primary metal manufacturing ,663.0,628.0,580.0
1560,Idaho,     Fabricated metal product manufacturing ,6448.0,6651.0,7346.0
1561,Idaho,     Machinery manufacturing ,3810.0,3965.0,4215.0
1562,Idaho,     Computer and electronic product manufacturing ,12351.0,11543.0,11020.0
1563,Idaho,"     Electrical equipment, appliance, and component manufacturing ",1451.0,1505.0,1604.0
1564,Idaho,"     Motor vehicles, bodies and trailers, and parts manufacturing ",,,2930.0
1565,Idaho,     Other transportation equipment manufacturing ,,,1175.0
1566,Idaho,     Furniture and related product manufacturing ,2226.0,2246.0,2386.0
1567,Idaho,     Miscellaneous manufacturing ,3346.0,3478.0,3578.0
1568,Idaho,    Nondurable goods manufacturing ,31385.0,31589.0,32608.0
1569,Idaho,     Food manufacturing ,19878.0,19820.0,20113.0
1570,Idaho,     Beverage and tobacco product manufacturing ,1253.0,1332.0,1560.0
1571,Idaho,     Textile mills ,62.0,,72.0
1572,Idaho,     Textile product mills ,330.0,344.0,386.0
1573,Idaho,     Apparel manufacturing ,545.0,640.0,728.0
1574,Idaho,     Leather and allied product manufacturing ,331.0,335.0,326.0
1575,Idaho,     Paper manufacturing ,1858.0,1866.0,1860.0
1576,Idaho,     Printing and related support activities ,1609.0,1606.0,1624.0
1577,Idaho,     Petroleum and coal products manufacturing ,92.0,,68.0
1578,Idaho,     Chemical manufacturing ,3185.0,3283.0,3618.0
1579,Idaho,     Plastics and rubber products manufacturing ,2242.0,2242.0,2253.0
1580,Idaho,   Wholesale trade ,33748.0,34270.0,36081.0
1581,Idaho,   Retail trade ,111719.0,113136.0,119168.0
1582,Idaho,    Motor vehicle and parts dealers ,15095.0,14531.0,15153.0
1583,Idaho,    Furniture and home furnishings stores ,2756.0,2662.0,2878.0
1584,Idaho,    Electronics and appliance stores ,2614.0,2353.0,2323.0
1585,Idaho,    Building material and garden equipment and supplies dealers ,9251.0,9979.0,10473.0
1586,Idaho,    Food and beverage stores ,15777.0,16708.0,17151.0
1587,Idaho,    Health and personal care stores ,4908.0,4905.0,5390.0
1588,Idaho,    Gasoline stations ,7117.0,7120.0,7521.0
1589,Idaho,    Clothing and clothing accessories stores ,5449.0,4731.0,4755.0
1590,Idaho,"    Sporting goods, hobby, musical instrument, and book stores ",5771.0,5783.0,6273.0
1591,Idaho,    General merchandise stores ,16889.0,17448.0,18412.0
1592,Idaho,    Miscellaneous store retailers ,10543.0,10092.0,10676.0
1593,Idaho,    Nonstore retailers ,15549.0,16824.0,18163.0
1594,Idaho,   Transportation and warehousing ,35687.0,39464.0,46102.0
1595,Idaho,    Air transportation ,1706.0,1595.0,1763.0
1596,Idaho,    Rail transportation ,1284.0,1167.0,1115.0
1597,Idaho,    Water transportation ,,,
1598,Idaho,    Truck transportation ,15136.0,15378.0,15791.0
1599,Idaho,    Transit and ground passenger transportation ,6050.0,5072.0,5252.0
1600,Idaho,    Pipeline transportation ,,,
1601,Idaho,    Scenic and sightseeing transportation ,166.0,149.0,169.0
1602,Idaho,    Support activities for transportation ,2544.0,2624.0,2691.0
1603,Idaho,    Couriers and messengers ,6187.0,10780.0,16500.0
1604,Idaho,    Warehousing and storage ,2510.0,2612.0,2734.0
1605,Idaho,   Information ,11585.0,10442.0,11020.0
1606,Idaho,    Publishing industries (except Internet) ,2941.0,3115.0,3297.0
1607,Idaho,    Motion picture and sound recording industries ,1278.0,919.0,1010.0
1608,Idaho,    Broadcasting (except Internet) ,1436.0,1400.0,1362.0
1609,Idaho,    Internet publishing and broadcasting 3/,,,
1610,Idaho,    Telecommunications ,3480.0,2773.0,2937.0
1611,Idaho,"    Data processing, hosting, and related services ",1115.0,1108.0,1181.0
1612,Idaho,    Other information services 3/,1335.0,1127.0,1233.0
1613,Idaho,   Finance and insurance ,42979.0,47741.0,50029.0
1614,Idaho,    Monetary Authorities-central bank ,9.0,17.0,15.0
1615,Idaho,    Credit intermediation and related activities ,12604.0,13367.0,13845.0
1616,Idaho,"    Securities, commodity contracts, and other financial investments and related activities ",13196.0,15808.0,17065.0
1617,Idaho,    Insurance carriers and related activities ,15262.0,15923.0,16195.0
1618,Idaho,"    Funds, trusts, and other financial vehicles ",1908.0,2626.0,2909.0
1619,Idaho,   Real estate and rental and leasing ,52706.0,59708.0,62155.0
1620,Idaho,    Real estate ,48314.0,55348.0,57636.0
1621,Idaho,    Rental and leasing services ,4267.0,4227.0,4376.0
1622,Idaho,    Lessors of nonfinancial intangible assets (except copyrighted works) ,125.0,133.0,143.0
1623,Idaho,"   Professional, scientific, and technical services ",65414.0,68270.0,71512.0
1624,Idaho,   Management of companies and enterprises ,8739.0,9546.0,10169.0
1625,Idaho,   Administrative and support and waste management and remediation services ,62282.0,63198.0,64161.0
1626,Idaho,    Administrative and support services ,58278.0,59018.0,59721.0
1627,Idaho,    Waste management and remediation services ,4004.0,4180.0,4440.0
1628,Idaho,   Educational services ,22823.0,22261.0,23101.0
1629,Idaho,   Health care and social assistance ,112252.0,113879.0,117370.0
1630,Idaho,    Ambulatory health care services ,50129.0,51939.0,55029.0
1631,Idaho,    Hospitals ,24820.0,24700.0,25561.0
1632,Idaho,    Nursing and residential care facilities ,16152.0,16311.0,15684.0
1633,Idaho,    Social assistance ,21151.0,20929.0,21096.0
1634,Idaho,"   Arts, entertainment, and recreation ",23565.0,22157.0,24033.0
1635,Idaho,"    Performing arts, spectator sports, and related industries ",10296.0,9871.0,10312.0
1636,Idaho,"    Museums, historical sites, and similar institutions ",450.0,394.0,439.0
1637,Idaho,"    Amusement, gambling, and recreation industries ",12819.0,11892.0,13282.0
1638,Idaho,   Accommodation and food services ,76514.0,70575.0,78157.0
1639,Idaho,    Accommodation ,12669.0,10784.0,11868.0
1640,Idaho,    Food services and drinking places ,63845.0,59791.0,66289.0
1641,Idaho,   Other services (except government and government enterprises) ,52356.0,51040.0,52009.0
1642,Idaho,    Repair and maintenance ,14303.0,14520.0,14996.0
1643,Idaho,    Personal and laundry services ,20304.0,20301.0,20882.0
1644,Idaho,"    Religious, grantmaking, civic, professional, and similar organizations ",13257.0,12354.0,12133.0
1645,Idaho,    Private households ,4492.0,3865.0,3998.0
1646,Idaho,  Government and government enterprises ,137194.0,133816.0,134873.0
1647,Idaho,   Federal civilian ,13232.0,13719.0,13322.0
1648,Idaho,   Military ,9212.0,9319.0,9198.0
1649,Idaho,   State and local ,114750.0,110778.0,112353.0
1650,Idaho,    State government ,32326.0,30813.0,31136.0
1651,Idaho,    Local government ,82424.0,79965.0,81217.0
1652,Illinois,Total employment (number of jobs) ,7859703.0,7519502.0,7684747.0
1653,Illinois, Wage and salary employment ,6283547.0,5849130.0,5968913.0
1654,Illinois, Proprietors employment ,1576156.0,1670372.0,1715834.0
1655,Illinois,  Farm proprietors employment ,58783.0,58497.0,58369.0
1656,Illinois,  Nonfarm proprietors employment 2/,1517373.0,1611875.0,1657465.0
1657,Illinois, Farm employment ,71770.0,73908.0,74906.0
1658,Illinois, Nonfarm employment ,7787933.0,7445594.0,7609841.0
1659,Illinois,  Private nonfarm employment ,6913592.0,6610032.0,6773951.0
1660,Illinois,"   Forestry, fishing, and related activities ",12482.0,12674.0,12424.0
1661,Illinois,    Forestry and logging ,929.0,860.0,878.0
1662,Illinois,"    Fishing, hunting and trapping ",934.0,863.0,898.0
1663,Illinois,    Support activities for agriculture and forestry ,10619.0,10951.0,10648.0
1664,Illinois,"   Mining, quarrying, and oil and gas extraction ",17669.0,16243.0,15411.0
1665,Illinois,    Oil and gas extraction ,9146.0,8923.0,8307.0
1666,Illinois,    Mining (except oil and gas) ,6649.0,5747.0,5515.0
1667,Illinois,    Support activities for mining ,1874.0,1573.0,1589.0
1668,Illinois,   Utilities ,25476.0,24806.0,24439.0
1669,Illinois,   Construction ,336669.0,331794.0,342726.0
1670,Illinois,    Construction of buildings ,77452.0,78651.0,82553.0
1671,Illinois,    Heavy and civil engineering construction ,33162.0,32454.0,32962.0
1672,Illinois,    Specialty trade contractors ,226055.0,220689.0,227211.0
1673,Illinois,   Manufacturing ,605815.0,575259.0,575050.0
1674,Illinois,    Durable goods manufacturing ,355052.0,332807.0,328569.0
1675,Illinois,     Wood product manufacturing ,7858.0,7739.0,7956.0
1676,Illinois,     Nonmetallic mineral product manufacturing ,14800.0,14088.0,14017.0
1677,Illinois,     Primary metal manufacturing ,19471.0,17681.0,17562.0
1678,Illinois,     Fabricated metal product manufacturing ,93732.0,86293.0,87097.0
1679,Illinois,     Machinery manufacturing ,74944.0,69216.0,68103.0
1680,Illinois,     Computer and electronic product manufacturing ,31533.0,30104.0,29660.0
1681,Illinois,"     Electrical equipment, appliance, and component manufacturing ",22159.0,21541.0,21145.0
1682,Illinois,"     Motor vehicles, bodies and trailers, and parts manufacturing ",39952.0,36914.0,34863.0
1683,Illinois,     Other transportation equipment manufacturing ,6177.0,6771.0,6339.0
1684,Illinois,     Furniture and related product manufacturing ,13253.0,12325.0,12314.0
1685,Illinois,     Miscellaneous manufacturing ,31173.0,30135.0,29513.0
1686,Illinois,    Nondurable goods manufacturing ,250763.0,242452.0,246481.0
1687,Illinois,     Food manufacturing ,87036.0,85280.0,88337.0
1688,Illinois,     Beverage and tobacco product manufacturing ,8450.0,7739.0,8091.0
1689,Illinois,     Textile mills ,1160.0,1098.0,1160.0
1690,Illinois,     Textile product mills ,2942.0,2751.0,2983.0
1691,Illinois,     Apparel manufacturing ,4619.0,4463.0,4555.0
1692,Illinois,     Leather and allied product manufacturing ,1199.0,1016.0,1004.0
1693,Illinois,     Paper manufacturing ,19186.0,17449.0,17419.0
1694,Illinois,     Printing and related support activities ,27873.0,26059.0,24538.0
1695,Illinois,     Petroleum and coal products manufacturing ,6059.0,5971.0,5914.0
1696,Illinois,     Chemical manufacturing ,48385.0,48350.0,49023.0
1697,Illinois,     Plastics and rubber products manufacturing ,43854.0,42276.0,43457.0
1698,Illinois,   Wholesale trade ,312678.0,301515.0,301755.0
1699,Illinois,   Retail trade ,687501.0,681843.0,704797.0
1700,Illinois,    Motor vehicle and parts dealers ,76045.0,70635.0,71180.0
1701,Illinois,    Furniture and home furnishings stores ,18732.0,16720.0,17747.0
1702,Illinois,    Electronics and appliance stores ,22709.0,21850.0,21832.0
1703,Illinois,    Building material and garden equipment and supplies dealers ,46870.0,48799.0,50020.0
1704,Illinois,    Food and beverage stores ,119022.0,119560.0,119132.0
1705,Illinois,    Health and personal care stores ,54360.0,51805.0,54699.0
1706,Illinois,    Gasoline stations ,31323.0,30739.0,31955.0
1707,Illinois,    Clothing and clothing accessories stores ,54731.0,43578.0,46787.0
1708,Illinois,"    Sporting goods, hobby, musical instrument, and book stores ",24222.0,22781.0,25690.0
1709,Illinois,    General merchandise stores ,124578.0,124084.0,127611.0
1710,Illinois,    Miscellaneous store retailers ,52489.0,53733.0,57532.0
1711,Illinois,    Nonstore retailers ,62420.0,77559.0,80612.0
1712,Illinois,   Transportation and warehousing ,469870.0,478181.0,494193.0
1713,Illinois,    Air transportation ,40724.0,37549.0,35064.0
1714,Illinois,    Rail transportation ,13506.0,11852.0,11322.0
1715,Illinois,    Water transportation ,2234.0,1918.0,2269.0
1716,Illinois,    Truck transportation ,116338.0,115156.0,118546.0
1717,Illinois,    Transit and ground passenger transportation ,124167.0,107424.0,104572.0
1718,Illinois,    Pipeline transportation ,1032.0,1036.0,936.0
1719,Illinois,    Scenic and sightseeing transportation ,1464.0,770.0,863.0
1720,Illinois,    Support activities for transportation ,44741.0,41352.0,43250.0
1721,Illinois,    Couriers and messengers ,67362.0,93354.0,106709.0
1722,Illinois,    Warehousing and storage ,58302.0,67770.0,70662.0
1723,Illinois,   Information ,112022.0,105565.0,107221.0
1724,Illinois,    Publishing industries (except Internet) ,30555.0,30526.0,31464.0
1725,Illinois,    Motion picture and sound recording industries ,13201.0,8602.0,9821.0
1726,Illinois,    Broadcasting (except Internet) ,9693.0,9112.0,8646.0
1727,Illinois,    Internet publishing and broadcasting 3/,,,
1728,Illinois,    Telecommunications ,30994.0,29328.0,27406.0
1729,Illinois,"    Data processing, hosting, and related services ",13523.0,14107.0,15656.0
1730,Illinois,    Other information services 3/,14056.0,13890.0,14228.0
1731,Illinois,   Finance and insurance ,494484.0,528004.0,539554.0
1732,Illinois,    Monetary Authorities-central bank ,,1435.0,1463.0
1733,Illinois,    Credit intermediation and related activities ,127625.0,128774.0,129280.0
1734,Illinois,"    Securities, commodity contracts, and other financial investments and related activities ",178101.0,202661.0,216874.0
1735,Illinois,    Insurance carriers and related activities ,163907.0,165278.0,159397.0
1736,Illinois,"    Funds, trusts, and other financial vehicles ",,29856.0,32540.0
1737,Illinois,   Real estate and rental and leasing ,304926.0,323486.0,331078.0
1738,Illinois,    Real estate ,273364.0,295045.0,302692.0
1739,Illinois,    Rental and leasing services ,30522.0,27430.0,27345.0
1740,Illinois,    Lessors of nonfinancial intangible assets (except copyrighted works) ,1040.0,1011.0,1041.0
1741,Illinois,"   Professional, scientific, and technical services ",587544.0,575701.0,589254.0
1742,Illinois,   Management of companies and enterprises ,97741.0,95622.0,95205.0
1743,Illinois,   Administrative and support and waste management and remediation services ,548124.0,502433.0,525165.0
1744,Illinois,    Administrative and support services ,531676.0,486508.0,508925.0
1745,Illinois,    Waste management and remediation services ,16448.0,15925.0,16240.0
1746,Illinois,   Educational services ,214861.0,197713.0,199597.0
1747,Illinois,   Health care and social assistance ,892569.0,861012.0,870987.0
1748,Illinois,    Ambulatory health care services ,315725.0,304966.0,318139.0
1749,Illinois,    Hospitals ,245421.0,237871.0,235591.0
1750,Illinois,    Nursing and residential care facilities ,144690.0,135347.0,129244.0
1751,Illinois,    Social assistance ,186733.0,182828.0,188013.0
1752,Illinois,"   Arts, entertainment, and recreation ",172944.0,136429.0,147231.0
1753,Illinois,"    Performing arts, spectator sports, and related industries ",84997.0,72710.0,75631.0
1754,Illinois,"    Museums, historical sites, and similar institutions ",8576.0,6833.0,6424.0
1755,Illinois,"    Amusement, gambling, and recreation industries ",79371.0,56886.0,65176.0
1756,Illinois,   Accommodation and food services ,563387.0,434912.0,468840.0
1757,Illinois,    Accommodation ,61043.0,37962.0,38253.0
1758,Illinois,    Food services and drinking places ,502344.0,396950.0,430587.0
1759,Illinois,   Other services (except government and government enterprises) ,456830.0,426840.0,429024.0
1760,Illinois,    Repair and maintenance ,86674.0,84886.0,86431.0
1761,Illinois,    Personal and laundry services ,172085.0,161796.0,166048.0
1762,Illinois,"    Religious, grantmaking, civic, professional, and similar organizations ",153067.0,142470.0,139015.0
1763,Illinois,    Private households ,45004.0,37688.0,37530.0
1764,Illinois,  Government and government enterprises ,874341.0,835562.0,835890.0
1765,Illinois,   Federal civilian ,79066.0,82030.0,79550.0
1766,Illinois,   Military ,45739.0,47415.0,49397.0
1767,Illinois,   State and local ,749536.0,706117.0,706943.0
1768,Illinois,    State government ,151204.0,147649.0,147483.0
1769,Illinois,    Local government ,598332.0,558468.0,559460.0
1770,Indiana,Total employment (number of jobs) ,3970076.0,3843507.0,3950184.0
1771,Indiana, Wage and salary employment ,3253559.0,3084225.0,3172200.0
1772,Indiana, Proprietors employment ,716517.0,759282.0,777984.0
1773,Indiana,  Farm proprietors employment ,49028.0,48559.0,48238.0
1774,Indiana,  Nonfarm proprietors employment 2/,667489.0,710723.0,729746.0
1775,Indiana, Farm employment ,60566.0,60773.0,59053.0
1776,Indiana, Nonfarm employment ,3909510.0,3782734.0,3891131.0
1777,Indiana,  Private nonfarm employment ,3458197.0,3345591.0,3457587.0
1778,Indiana,"   Forestry, fishing, and related activities ",10554.0,,10760.0
1779,Indiana,    Forestry and logging ,1325.0,1293.0,1299.0
1780,Indiana,"    Fishing, hunting and trapping ",483.0,,463.0
1781,Indiana,    Support activities for agriculture and forestry ,8746.0,9247.0,8998.0
1782,Indiana,"   Mining, quarrying, and oil and gas extraction ",9188.0,,8007.0
1783,Indiana,    Oil and gas extraction ,2834.0,,2559.0
1784,Indiana,    Mining (except oil and gas) ,5735.0,5073.0,4783.0
1785,Indiana,    Support activities for mining ,619.0,,665.0
1786,Indiana,   Utilities ,14328.0,14351.0,14137.0
1787,Indiana,   Construction ,213706.0,217325.0,226187.0
1788,Indiana,    Construction of buildings ,51200.0,51978.0,53751.0
1789,Indiana,    Heavy and civil engineering construction ,20964.0,22186.0,23537.0
1790,Indiana,    Specialty trade contractors ,141542.0,143161.0,148899.0
1791,Indiana,   Manufacturing ,555755.0,519497.0,539654.0
1792,Indiana,    Durable goods manufacturing ,398866.0,367807.0,381969.0
1793,Indiana,     Wood product manufacturing ,15869.0,15397.0,16104.0
1794,Indiana,     Nonmetallic mineral product manufacturing ,14509.0,13331.0,13332.0
1795,Indiana,     Primary metal manufacturing ,42616.0,38935.0,39389.0
1796,Indiana,     Fabricated metal product manufacturing ,62420.0,56144.0,56906.0
1797,Indiana,     Machinery manufacturing ,46265.0,42575.0,42489.0
1798,Indiana,     Computer and electronic product manufacturing ,13412.0,12665.0,12884.0
1799,Indiana,"     Electrical equipment, appliance, and component manufacturing ",9294.0,8866.0,8731.0
1800,Indiana,"     Motor vehicles, bodies and trailers, and parts manufacturing ",125457.0,115551.0,127161.0
1801,Indiana,     Other transportation equipment manufacturing ,11393.0,10266.0,10535.0
1802,Indiana,     Furniture and related product manufacturing ,24639.0,23091.0,23642.0
1803,Indiana,     Miscellaneous manufacturing ,32992.0,30986.0,30796.0
1804,Indiana,    Nondurable goods manufacturing ,156889.0,151690.0,157685.0
1805,Indiana,     Food manufacturing ,41808.0,41933.0,43034.0
1806,Indiana,     Beverage and tobacco product manufacturing ,6576.0,6329.0,6895.0
1807,Indiana,     Textile mills ,791.0,718.0,835.0
1808,Indiana,     Textile product mills ,3134.0,3063.0,3271.0
1809,Indiana,     Apparel manufacturing ,1269.0,1221.0,1375.0
1810,Indiana,     Leather and allied product manufacturing ,825.0,745.0,761.0
1811,Indiana,     Paper manufacturing ,10375.0,9907.0,10080.0
1812,Indiana,     Printing and related support activities ,15578.0,14084.0,13379.0
1813,Indiana,     Petroleum and coal products manufacturing ,3869.0,3751.0,3632.0
1814,Indiana,     Chemical manufacturing ,32213.0,32605.0,35086.0
1815,Indiana,     Plastics and rubber products manufacturing ,40451.0,37334.0,39337.0
1816,Indiana,   Wholesale trade ,131968.0,127810.0,130695.0
1817,Indiana,   Retail trade ,381519.0,374960.0,385446.0
1818,Indiana,    Motor vehicle and parts dealers ,49166.0,47213.0,47919.0
1819,Indiana,    Furniture and home furnishings stores ,9831.0,9054.0,9569.0
1820,Indiana,    Electronics and appliance stores ,8335.0,7569.0,7320.0
1821,Indiana,    Building material and garden equipment and supplies dealers ,32313.0,33382.0,33993.0
1822,Indiana,    Food and beverage stores ,46995.0,47550.0,46253.0
1823,Indiana,    Health and personal care stores ,23026.0,21701.0,22433.0
1824,Indiana,    Gasoline stations ,24538.0,22905.0,23021.0
1825,Indiana,    Clothing and clothing accessories stores ,21787.0,17854.0,19022.0
1826,Indiana,"    Sporting goods, hobby, musical instrument, and book stores ",13852.0,12919.0,13965.0
1827,Indiana,    General merchandise stores ,75006.0,75561.0,77669.0
1828,Indiana,    Miscellaneous store retailers ,34866.0,33715.0,35751.0
1829,Indiana,    Nonstore retailers ,41804.0,45537.0,48531.0
1830,Indiana,   Transportation and warehousing ,197687.0,212684.0,226560.0
1831,Indiana,    Air transportation ,3779.0,3423.0,3375.0
1832,Indiana,    Rail transportation ,,,
1833,Indiana,    Water transportation ,,,
1834,Indiana,    Truck transportation ,71509.0,68524.0,70425.0
1835,Indiana,    Transit and ground passenger transportation ,24359.0,20634.0,20207.0
1836,Indiana,    Pipeline transportation ,535.0,520.0,518.0
1837,Indiana,    Scenic and sightseeing transportation ,318.0,302.0,537.0
1838,Indiana,    Support activities for transportation ,12076.0,11660.0,12370.0
1839,Indiana,    Couriers and messengers ,30870.0,47184.0,54198.0
1840,Indiana,    Warehousing and storage ,47716.0,54008.0,58843.0
1841,Indiana,   Information ,36550.0,34389.0,34348.0
1842,Indiana,    Publishing industries (except Internet) ,9716.0,9122.0,9177.0
1843,Indiana,    Motion picture and sound recording industries ,4345.0,2928.0,2913.0
1844,Indiana,    Broadcasting (except Internet) ,5038.0,4724.0,4629.0
1845,Indiana,    Internet publishing and broadcasting 3/,,,
1846,Indiana,    Telecommunications ,11506.0,11699.0,11399.0
1847,Indiana,"    Data processing, hosting, and related services ",3787.0,3773.0,4127.0
1848,Indiana,    Other information services 3/,2158.0,2143.0,2103.0
1849,Indiana,   Finance and insurance ,153962.0,162865.0,166609.0
1850,Indiana,    Monetary Authorities-central bank ,5.0,5.0,12.0
1851,Indiana,    Credit intermediation and related activities ,43891.0,44547.0,45351.0
1852,Indiana,"    Securities, commodity contracts, and other financial investments and related activities ",38698.0,45021.0,48523.0
1853,Indiana,    Insurance carriers and related activities ,67032.0,67960.0,66813.0
1854,Indiana,"    Funds, trusts, and other financial vehicles ",4336.0,5332.0,5910.0
